{
  "schemaVersion": "1.0",
  "boardId": "board.feature-auth",
  "blueprintRunDir": ".",
  "lanes": [
    "Intake",
    "Discovery",
    "Scoped",
    "Blueprint Bound",
    "Contract Frozen",
    "Ready",
    "Claimed",
    "Running",
    "Decomposing",
    "Verifying",
    "Human Review",
    "Done",
    "Failed Fast",
    "Rework",
    "Blocked",
    "Cancelled"
  ],
  "workItemDAG": {
    "schemaVersion": "1.0",
    "nodes": [
      {
        "workItemId": "work.feature-auth",
        "kind": "implementation",
        "requiredForDone": true
      }
    ],
    "edges": []
  },
  "workItems": [
    {
      "schemaVersion": "1.0",
      "id": "work.feature-auth",
      "title": "Implement feature-auth login surface",
      "lane": "Contract Frozen",
      "responsibilityUnitId": "ru.frontend",
      "contractIds": ["contract.auth.login"],
      "dependsOn": [],
      "allowedPaths": ["apps/web/auth/**"],
      "prdId": "prd.auth",
      "prdTrace": {
        "acceptanceCriteriaIds": ["AC-001", "AC-002", "AC-003"]
      },
      "doneEvidence": [
        {
          "kind": "verification",
          "path": "evidence/verification.json"
        },
        {
          "kind": "wiki-sync",
          "path": "evidence/wiki-sync.json"
        }
      ],
      "verificationCommands": [
        {
          "file": "node",
          "args": ["-e", "console.log('verification ok')"]
        }
      ]
    }
  ]
}
